{
  "name": "油醋爆蛋",
  "source_file": "../../../../../tmp/howtocook_7mx19gjp/HowToCook/dishes/vegetable_dish/油醋爆蛋.md",
  "category": "荤菜",
  "difficulty": "medium",
  "total_time_minutes": 10,
  "servings": 1,
  "original_servings": 2,
  "images": [],
  "ingredients": [
    {
      "ingredient_name": "鸡蛋",
      "quantity": 2,
      "unit": "个",
      "quantity_range": null,
      "is_optional": false,
      "note": null,
      "original_quantity": null,
      "is_estimated": false
    },
    {
      "ingredient_name": "小米辣",
      "quantity": 5,
      "unit": "g",
      "quantity_range": null,
      "is_optional": false,
      "note": "约 1.5 个",
      "original_quantity": null,
      "is_estimated": false
    },
    {
      "ingredient_name": "食用油",
      "quantity": 25,
      "unit": "mL",
      "quantity_range": {
        "min": 17.5,
        "max": 25
      },
      "is_optional": false,
      "note": null,
      "original_quantity": null,
      "is_estimated": false
    },
    {
      "ingredient_name": "小葱",
      "quantity": 5,
      "unit": "g",
      "quantity_range": null,
      "is_optional": false,
      "note": null,
      "original_quantity": null,
      "is_estimated": false
    },
    {
      "ingredient_name": "蒜",
      "quantity": 2.5,
      "unit": "g",
      "quantity_range": null,
      "is_optional": false,
      "note": null,
      "original_quantity": null,
      "is_estimated": false
    },
    {
      "ingredient_name": "香醋",
      "quantity": 7.5,
      "unit": "mL",
      "quantity_range": null,
      "is_optional": false,
      "note": null,
      "original_quantity": null,
      "is_estimated": false
    },
    {
      "ingredient_name": "生抽",
      "quantity": 7.5,
      "unit": "mL",
      "quantity_range": {
        "min": 5,
        "max": 7.5
      },
      "is_optional": false,
      "note": null,
      "original_quantity": null,
      "is_estimated": false
    },
    {
      "ingredient_name": "蚝油",
      "quantity": 5,
      "unit": "g",
      "quantity_range": null,
      "is_optional": false,
      "note": "可选但推荐",
      "original_quantity": null,
      "is_estimated": false
    },
    {
      "ingredient_name": "白糖",
      "quantity": 2.5,
      "unit": "g",
      "quantity_range": {
        "min": 0,
        "max": 2.5
      },
      "is_optional": true,
      "note": "可选",
      "original_quantity": null,
      "is_estimated": false
    },
    {
      "ingredient_name": "水",
      "quantity": 10,
      "unit": "mL",
      "quantity_range": null,
      "is_optional": false,
      "note": "用于调制糖醋料汁",
      "original_quantity": null,
      "is_estimated": true
    }
  ],
  "steps": [
    {
      "step": 1,
      "content": "鸡蛋不需打散，直接打入碗中备用",
      "duration_minutes": 1,
      "tips": null
    },
    {
      "step": 2,
      "content": "香葱切 3cm 长小段即可",
      "duration_minutes": 1,
      "tips": null
    },
    {
      "step": 3,
      "content": "蒜瓣和小米辣放入打蒜器，打成沫",
      "duration_minutes": 2,
      "tips": null
    },
    {
      "step": 4,
      "content": "将香醋、生抽、蚝油、白糖、水加入小碗，搅拌均匀作为糖醋料汁",
      "duration_minutes": 1,
      "tips": null
    },
    {
      "step": 5,
      "content": "油热倒入鸡蛋，等鸡蛋凝固之后铲成大块，倒入蒜沫、小米辣沫、倒入糖醋料汁",
      "duration_minutes": 3,
      "tips": null
    },
    {
      "step": 6,
      "content": "大火收汁、快出锅时加入葱段即可",
      "duration_minutes": 2,
      "tips": null
    }
  ],
  "tips": [
    "老恒和酿造香醋零添加口味最好，醋香是本菜灵魂所在"
  ]
}