{
  "name": "无厨师机蜂蜜面包",
  "source_file": "../../../../../tmp/howtocook_7mx19gjp/HowToCook/dishes/dessert/无厨师机蜂蜜面包/无厨师机蜂蜜面包.md",
  "category": "早餐",
  "difficulty": "expert",
  "total_time_minutes": null,
  "servings": 1,
  "original_servings": null,
  "images": [
    "images/无厨师机蜂蜜面包_0.jpg"
  ],
  "ingredients": [
    {
      "ingredient_name": "高筋面粉",
      "quantity": 67,
      "unit": "g",
      "quantity_range": null,
      "is_optional": false,
      "note": null,
      "original_quantity": null,
      "is_estimated": false
    },
    {
      "ingredient_name": "牛奶",
      "quantity": 33,
      "unit": "g",
      "quantity_range": null,
      "is_optional": false,
      "note": "建议加热到40℃",
      "original_quantity": null,
      "is_estimated": false
    },
    {
      "ingredient_name": "酵母",
      "quantity": 0.67,
      "unit": "g",
      "quantity_range": null,
      "is_optional": false,
      "note": null,
      "original_quantity": null,
      "is_estimated": false
    },
    {
      "ingredient_name": "鸡蛋",
      "quantity": 0.17,
      "unit": "个",
      "quantity_range": null,
      "is_optional": false,
      "note": null,
      "original_quantity": null,
      "is_estimated": false
    },
    {
      "ingredient_name": "白砂糖",
      "quantity": 12,
      "unit": "g",
      "quantity_range": null,
      "is_optional": false,
      "note": null,
      "original_quantity": null,
      "is_estimated": false
    },
    {
      "ingredient_name": "盐",
      "quantity": 0.33,
      "unit": "g",
      "quantity_range": null,
      "is_optional": false,
      "note": null,
      "original_quantity": null,
      "is_estimated": false
    },
    {
      "ingredient_name": "黄油",
      "quantity": 5,
      "unit": "g",
      "quantity_range": null,
      "is_optional": false,
      "note": null,
      "original_quantity": null,
      "is_estimated": false
    },
    {
      "ingredient_name": "蜂蜜",
      "quantity": 3.33,
      "unit": "g",
      "quantity_range": null,
      "is_optional": false,
      "note": "用于涂在顶部",
      "original_quantity": null,
      "is_estimated": false
    },
    {
      "ingredient_name": "水",
      "quantity": 3.33,
      "unit": "g",
      "quantity_range": null,
      "is_optional": false,
      "note": "与蜂蜜混合涂在顶部",
      "original_quantity": null,
      "is_estimated": false
    },
    {
      "ingredient_name": "芝麻",
      "quantity": 1,
      "unit": "g",
      "quantity_range": null,
      "is_optional": true,
      "note": "洒在顶部",
      "original_quantity": "适量",
      "is_estimated": true
    },
    {
      "ingredient_name": "花生油",
      "quantity": 5,
      "unit": "g",
      "quantity_range": null,
      "is_optional": false,
      "note": "烤盘用油",
      "original_quantity": null,
      "is_estimated": false
    }
  ],
  "steps": [
    {
      "step": 1,
      "content": "将高筋面粉、牛奶（建议加热到40℃，可使用微波炉加热15-20秒）、酵母、鸡蛋、白砂糖和盐混合起来。",
      "duration_minutes": 10,
      "tips": "确保牛奶温度适宜，约40℃不烫手"
    },
    {
      "step": 2,
      "content": "搅拌面团，将原料混合均匀成团。",
      "duration_minutes": 10,
      "tips": null
    },
    {
      "step": 3,
      "content": "加入黄油混合。",
      "duration_minutes": 5,
      "tips": null
    },
    {
      "step": 4,
      "content": "继续搅拌并用手揉，使黄油均匀混合。",
      "duration_minutes": 10,
      "tips": null
    },
    {
      "step": 5,
      "content": "开始发面，使用保鲜膜覆盖容器，普通气温（10-20℃）放置1-2小时。",
      "duration_minutes": 90,
      "tips": "稍长时间对效果影响不大，明显看到面团发酵变大（2倍）即可"
    },
    {
      "step": 6,
      "content": "切分面团，理想状态每一份60g（美观），可根据喜好适当调整大小。此时面团应该不再十分黏手。",
      "duration_minutes": 10,
      "tips": null
    },
    {
      "step": 7,
      "content": "将每一份小面团使用擀面杖擀成舌状后卷起，再次醒面10分钟。",
      "duration_minutes": 10,
      "tips": null
    },
    {
      "step": 8,
      "content": "再次使用擀面杖擀成舌状后卷起，从中间切开（一个变成两个）。",
      "duration_minutes": 5,
      "tips": null
    },
    {
      "step": 9,
      "content": "再次使用擀面杖擀成舌状后卷起，从中间切开（两个变成四个）。",
      "duration_minutes": 5,
      "tips": "此步骤可以按照自己的时间多擀/卷几次，把握一份的大小就行"
    },
    {
      "step": 10,
      "content": "烤盘放入油纸并倒入花生油，每份卷好的底部蘸水加面粉后放入烤盘。",
      "duration_minutes": 5,
      "tips": null
    },
    {
      "step": 11,
      "content": "再次醒发（盖上保鲜膜），这一步可以放入冰箱，第二天再烤。",
      "duration_minutes": 60,
      "tips": "可以冷藏过夜，第二天直接烤制"
    },
    {
      "step": 12,
      "content": "刷上蛋液。",
      "duration_minutes": 5,
      "tips": null
    },
    {
      "step": 13,
      "content": "烤箱180℃（355°F），18-20分钟。",
      "duration_minutes": 20,
      "tips": "注意观察烤箱温度和上色情况"
    },
    {
      "step": 14,
      "content": "出炉后，刷上蜂蜜水，撒上芝麻。",
      "duration_minutes": 5,
      "tips": "趁热刷蜂蜜水效果更好"
    }
  ],
  "tips": [
    "发面时间并不固定，每1小时看一下确认就可以，明显发酵变大即可，建议发酵2-2.5倍大",
    "面团大小不会显著影响口感和烘烤效果，可根据喜好调整",
    "冰箱储存会变硬，微波炉加热10-20秒即可恢复软嫩口感"
  ]
}