{
  "name": "金枪鱼酱三明治",
  "source_file": "../../../../../tmp/howtocook_7mx19gjp/HowToCook/dishes/breakfast/金枪鱼酱三明治.md",
  "category": "早餐",
  "difficulty": "simple",
  "total_time_minutes": 5,
  "servings": 1,
  "original_servings": null,
  "images": [],
  "ingredients": [
    {
      "ingredient_name": "水浸金枪鱼",
      "quantity": 65,
      "unit": "g",
      "quantity_range": null,
      "is_optional": false,
      "note": "不建议用油浸，会很腻",
      "original_quantity": null,
      "is_estimated": false
    },
    {
      "ingredient_name": "方形吐司片",
      "quantity": 2,
      "unit": "片",
      "quantity_range": null,
      "is_optional": false,
      "note": null,
      "original_quantity": null,
      "is_estimated": false
    },
    {
      "ingredient_name": "蛋黄酱",
      "quantity": 50,
      "unit": "mL",
      "quantity_range": null,
      "is_optional": false,
      "note": null,
      "original_quantity": null,
      "is_estimated": false
    },
    {
      "ingredient_name": "俄式酸黄瓜汁",
      "quantity": 15,
      "unit": "mL",
      "quantity_range": {
        "min": 10,
        "max": 15
      },
      "is_optional": false,
      "note": "可根据个人口味调整",
      "original_quantity": null,
      "is_estimated": false
    },
    {
      "ingredient_name": "芝士片",
      "quantity": 1,
      "unit": "片",
      "quantity_range": null,
      "is_optional": true,
      "note": null,
      "original_quantity": "适量",
      "is_estimated": true
    },
    {
      "ingredient_name": "火腿片",
      "quantity": 1,
      "unit": "片",
      "quantity_range": null,
      "is_optional": true,
      "note": null,
      "original_quantity": "适量",
      "is_estimated": true
    }
  ],
  "steps": [
    {
      "step": 1,
      "content": "将金枪鱼、蛋黄酱、俄式酸黄瓜汁倒入碗中，用勺子搅拌，保证将金枪鱼块搅碎，酱整体呈糊状，并备用",
      "duration_minutes": null,
      "tips": null
    },
    {
      "step": 2,
      "content": "将 1 片吐司放在轻食机上",
      "duration_minutes": null,
      "tips": null
    },
    {
      "step": 3,
      "content": "将做好的金枪鱼酱涂抹到吐司上，建议 10-15ml",
      "duration_minutes": null,
      "tips": null
    },
    {
      "step": 4,
      "content": "将另一片方形吐司片覆盖在上面，并按压轻食机，开机",
      "duration_minutes": null,
      "tips": "注意在按压操作之前不要将轻食机电源接通，以免引发安全问题"
    },
    {
      "step": 5,
      "content": "待轻食机自动停止加热，即可装盘使用",
      "duration_minutes": null,
      "tips": null
    }
  ],
  "tips": [
    "金枪鱼酱可以在前一天晚上在冰箱冷藏",
    "金枪鱼酱建议冷藏时间不超过一周，切需要使用保鲜膜盖住"
  ]
}