{
  "name": "萝卜炖羊排",
  "source_file": "../../../../../tmp/howtocook_7mx19gjp/HowToCook/dishes/meat_dish/萝卜炖羊排.md",
  "category": "荤菜",
  "difficulty": "medium",
  "total_time_minutes": 50,
  "servings": 1,
  "original_servings": 2,
  "images": [],
  "ingredients": [
    {
      "ingredient_name": "羊排",
      "quantity": 200,
      "unit": "g",
      "quantity_range": null,
      "is_optional": false,
      "note": null,
      "original_quantity": null,
      "is_estimated": false
    },
    {
      "ingredient_name": "白萝卜",
      "quantity": 0.5,
      "unit": "根",
      "quantity_range": null,
      "is_optional": false,
      "note": null,
      "original_quantity": null,
      "is_estimated": false
    },
    {
      "ingredient_name": "大葱",
      "quantity": 0.5,
      "unit": "根",
      "quantity_range": null,
      "is_optional": false,
      "note": null,
      "original_quantity": null,
      "is_estimated": false
    },
    {
      "ingredient_name": "花椒",
      "quantity": 5,
      "unit": "粒",
      "quantity_range": null,
      "is_optional": false,
      "note": null,
      "original_quantity": null,
      "is_estimated": false
    },
    {
      "ingredient_name": "姜",
      "quantity": 5,
      "unit": "g",
      "quantity_range": null,
      "is_optional": false,
      "note": "约2片",
      "original_quantity": null,
      "is_estimated": false
    },
    {
      "ingredient_name": "料酒或者黄酒",
      "quantity": 20,
      "unit": "mL",
      "quantity_range": {
        "min": 15,
        "max": 20
      },
      "is_optional": false,
      "note": null,
      "original_quantity": null,
      "is_estimated": false
    },
    {
      "ingredient_name": "食用盐",
      "quantity": 5,
      "unit": "g",
      "quantity_range": null,
      "is_optional": false,
      "note": null,
      "original_quantity": null,
      "is_estimated": false
    },
    {
      "ingredient_name": "冰糖",
      "quantity": 2,
      "unit": "粒",
      "quantity_range": {
        "min": 1,
        "max": 2
      },
      "is_optional": false,
      "note": null,
      "original_quantity": null,
      "is_estimated": false
    },
    {
      "ingredient_name": "水",
      "quantity": 500,
      "unit": "mL",
      "quantity_range": null,
      "is_optional": false,
      "note": null,
      "original_quantity": null,
      "is_estimated": false
    },
    {
      "ingredient_name": "白芷",
      "quantity": null,
      "unit": null,
      "quantity_range": null,
      "is_optional": true,
      "note": null,
      "original_quantity": null,
      "is_estimated": false
    }
  ],
  "steps": [
    {
      "step": 1,
      "content": "萝卜去皮、滚刀切成 3-5cm 的大块，备用",
      "duration_minutes": 5,
      "tips": null
    },
    {
      "step": 2,
      "content": "羊排在购买时可以让卖家切好，因为家用刀一般难以切动，备用",
      "duration_minutes": null,
      "tips": null
    },
    {
      "step": 3,
      "content": "羊肉冷水下锅，加入一半的料酒，一半的葱姜，煮 10 分钟去掉血腥，（可选）把焯的过程中出现的血沫子可以用勺子盛出来",
      "duration_minutes": 10,
      "tips": "可选操作：盛出血沫子"
    },
    {
      "step": 4,
      "content": "另起一锅冷水，放入切好的白萝卜，放入一半的冰糖，等水开后煮 5 分钟去掉白萝卜的辣味",
      "duration_minutes": 5,
      "tips": null
    },
    {
      "step": 5,
      "content": "盛出来焯好的羊排，放入高压锅中，加水没过所有食材后再增加大约 300ml 的水",
      "duration_minutes": 2,
      "tips": "一人份加水约 150ml"
    },
    {
      "step": 6,
      "content": "将剩余的葱姜料酒，花椒，冰糖，白芷（可选），盐放入锅中，盖锅等待上汽后计时，中火炖大约 15 分钟。如没有高压锅，则放入普通锅中，炖大约 40 分钟到 1 小时。",
      "duration_minutes": 15,
      "tips": "普通锅需炖 40-60 分钟"
    },
    {
      "step": 7,
      "content": "关火，等待高压锅放气完毕，开盖，加入之前焯好的萝卜，调味，加入 3-10g 的食盐或者水，品尝汤的咸淡",
      "duration_minutes": 5,
      "tips": "一人份可调整盐量为 1-5g"
    },
    {
      "step": 8,
      "content": "再开火，中火，高压锅上汽再炖 10 分钟，普通锅盖盖再炖 20 分钟，然后关火，盛盘",
      "duration_minutes": 10,
      "tips": "普通锅需再炖 20 分钟"
    }
  ],
  "tips": [
    "操作时，需要注意观察沸腾的水位线，如发现低于 2/3 的食材应加热水至没过食材。",
    "使用高压锅时注意安全，等待放气完毕后再开盖。",
    "可以根据个人口味调整盐和冰糖的用量。"
  ]
}