{
  "name": "糖醋汁",
  "source_file": "../../../../../tmp/howtocook_7mx19gjp/HowToCook/dishes/condiment/糖醋汁.md",
  "category": "调料",
  "difficulty": "easy",
  "total_time_minutes": 15,
  "servings": 1,
  "original_servings": null,
  "images": [],
  "ingredients": [
    {
      "ingredient_name": "清水",
      "quantity": 50,
      "unit": "mL",
      "quantity_range": null,
      "is_optional": false,
      "note": null,
      "original_quantity": null,
      "is_estimated": false
    },
    {
      "ingredient_name": "生抽",
      "quantity": 40,
      "unit": "mL",
      "quantity_range": null,
      "is_optional": false,
      "note": null,
      "original_quantity": null,
      "is_estimated": false
    },
    {
      "ingredient_name": "白糖",
      "quantity": 30,
      "unit": "g",
      "quantity_range": null,
      "is_optional": false,
      "note": null,
      "original_quantity": null,
      "is_estimated": false
    },
    {
      "ingredient_name": "白醋",
      "quantity": 20,
      "unit": "mL",
      "quantity_range": null,
      "is_optional": false,
      "note": "可用米醋替代",
      "original_quantity": null,
      "is_estimated": false
    },
    {
      "ingredient_name": "料酒",
      "quantity": 10,
      "unit": "mL",
      "quantity_range": null,
      "is_optional": false,
      "note": null,
      "original_quantity": null,
      "is_estimated": false
    }
  ],
  "steps": [
    {
      "step": 1,
      "content": "按照比例将各调料在小碗中搅拌均匀",
      "duration_minutes": 3,
      "tips": null
    },
    {
      "step": 2,
      "content": "按不同菜肴的方式处理完毕后，将配制好的糖醋汁倒入锅中",
      "duration_minutes": 2,
      "tips": null
    },
    {
      "step": 3,
      "content": "根据各菜肴的不同，烹制 5-10 分钟",
      "duration_minutes": 5,
      "tips": null
    },
    {
      "step": 4,
      "content": "大火收汁，可增加菜的浓度、香味和光泽",
      "duration_minutes": 5,
      "tips": null
    }
  ],
  "tips": [
    "可依据糖醋汁配制的经典比例 1：2：3：4：5 来调制糖醋汁（料酒:生抽:白糖:清水:白醋）"
  ]
}