{
  "name": "可乐鸡翅",
  "source_file": "../../../../../tmp/howtocook_7mx19gjp/HowToCook/dishes/meat_dish/可乐鸡翅.md",
  "category": "荤菜",
  "difficulty": "medium",
  "total_time_minutes": 45,
  "servings": 1,
  "original_servings": null,
  "images": [],
  "ingredients": [
    {
      "ingredient_name": "鸡翅",
      "quantity": 500,
      "unit": "g",
      "quantity_range": {
        "min": 400,
        "max": 500
      },
      "is_optional": false,
      "note": "鸡翅中 10-12 只",
      "original_quantity": null,
      "is_estimated": false
    },
    {
      "ingredient_name": "可乐",
      "quantity": 500,
      "unit": "mL",
      "quantity_range": null,
      "is_optional": false,
      "note": null,
      "original_quantity": null,
      "is_estimated": false
    },
    {
      "ingredient_name": "白糖",
      "quantity": 10,
      "unit": "g",
      "quantity_range": null,
      "is_optional": false,
      "note": null,
      "original_quantity": null,
      "is_estimated": false
    },
    {
      "ingredient_name": "生抽",
      "quantity": 13,
      "unit": "g",
      "quantity_range": null,
      "is_optional": false,
      "note": "腌制 10g + 调味 3g",
      "original_quantity": null,
      "is_estimated": false
    },
    {
      "ingredient_name": "老抽",
      "quantity": 3,
      "unit": "g",
      "quantity_range": null,
      "is_optional": false,
      "note": "用于调底色",
      "original_quantity": null,
      "is_estimated": false
    },
    {
      "ingredient_name": "盐",
      "quantity": 2,
      "unit": "g",
      "quantity_range": null,
      "is_optional": false,
      "note": null,
      "original_quantity": null,
      "is_estimated": false
    },
    {
      "ingredient_name": "生姜",
      "quantity": 10,
      "unit": "g",
      "quantity_range": null,
      "is_optional": false,
      "note": "2 片",
      "original_quantity": null,
      "is_estimated": false
    },
    {
      "ingredient_name": "料酒",
      "quantity": 20,
      "unit": "mL",
      "quantity_range": {
        "min": 10,
        "max": 20
      },
      "is_optional": false,
      "note": "可用于焯水",
      "original_quantity": null,
      "is_estimated": false
    },
    {
      "ingredient_name": "小葱",
      "quantity": 10,
      "unit": "g",
      "quantity_range": null,
      "is_optional": false,
      "note": "挽成结",
      "original_quantity": null,
      "is_estimated": false
    }
  ],
  "steps": [
    {
      "step": 1,
      "content": "鸡翅入锅，倒入冷水淹没。放生姜 1 片和料酒 10～20 毫升。大火煮开（大约 2 分钟）后，撇去浮沫，沥出水分。",
      "duration_minutes": 5,
      "tips": "这一步针对冰鲜鸡翅，刚买来的鸡翅直接改刀用生抽进行腌制即可。"
    },
    {
      "step": 2,
      "content": "捞出鸡翅，可用刀将两边各划上两口改刀。生抽约 10 克腌制鸡翅 10 分钟（生抽能完全包裹鸡翅表面入味就行）。",
      "duration_minutes": 12,
      "tips": null
    },
    {
      "step": 3,
      "content": "锅重新小火起油，先将剩余姜片爆香，然后下入腌好的鸡翅。将鸡翅煎至金黄翻面（直到两面金黄），用炒菜勺子翻动一下鸡翅，与姜片一起翻炒 4～5 下（目的是防止鸡翅和姜片粘黏）。",
      "duration_minutes": 8,
      "tips": null
    },
    {
      "step": 4,
      "content": "鸡翅金黄，倒入可乐没过鸡翅，开大火将锅中可乐煮沸，然后撇去漂浮的黑色浮沫（包含血水）。此时加入葱结。",
      "duration_minutes": 5,
      "tips": null
    },
    {
      "step": 5,
      "content": "调味：加入食用盐 2 克，白糖 10 克，生抽 3 克调味（可以适当用老抽调底色，3 克）。",
      "duration_minutes": 2,
      "tips": null
    },
    {
      "step": 6,
      "content": "等到葱结变黄，和姜片一起捞出，转中火继续慢煮可乐鸡翅。",
      "duration_minutes": 8,
      "tips": null
    },
    {
      "step": 7,
      "content": "等到可乐呈现挂丝状态，关小火让汁牢牢挂在鸡翅上。出锅，装盘。",
      "duration_minutes": 5,
      "tips": null
    }
  ],
  "tips": [
    "加入生姜爆香的同时能防止鸡翅粘锅。",
    "最后收汁时勿开过大火，防止味道偏苦。",
    "本菜品偏甜。"
  ]
}